{
  "schema_version": "1.0.0",
  "language_version": "0.1",
  "package": {
    "name": "g7.kananaskis_2025.ai_sme.literal",
    "version": "1.0.0",
    "content_hash": "sha256:0000000000000000000000000000000000000000000000000000000000000000",
    "imports": []
  },
  "sources": [
    {
      "id": "ai_chapter",
      "uri": "https://www.g7.utoronto.ca/evaluations/2025compliance-final/04-2025-G7-final-compliance-ai.pdf",
      "media_type": "application/pdf"
    }
  ],
  "types": [],
  "commitments": [
    {
      "id": "AI_SME_ADOPTION",
      "title": "Sustain investments in AI adoption programs for SMEs",
      "summit_id": "Kananaskis2025",
      "adopted_at": "2025-06-17",
      "subjects": [
        "Canada",
        "France",
        "Germany",
        "Italy",
        "Japan",
        "UnitedKingdom",
        "UnitedStates",
        "EuropeanUnion"
      ],
      "evaluation_window": {
        "start": "2025-06-18",
        "end": "2026-06-01",
        "start_inclusive": true,
        "end_inclusive": true
      },
      "issue_areas": [
        "artificial_intelligence",
        "digital_economy"
      ],
      "evidence_policy": "open_world",
      "unknown_policy": "propagate",
      "parameters": [],
      "action_identity": {
        "policy": "review_required",
        "key_paths": [
          "underlying_instrument_id",
          "program_family_id"
        ]
      },
      "predicates": [],
      "classifications": [],
      "variables": [
        {
          "id": "strong_count",
          "type": "Int",
          "expression": {
            "kind": "query",
            "operation": "count_distinct",
            "collection": "actions",
            "where": {
              "kind": "compare",
              "op": "eq",
              "left": {
                "kind": "ref",
                "path": "classification"
              },
              "right": {
                "kind": "literal",
                "value": "strong"
              }
            },
            "distinct_by": "underlying_instrument_id"
          }
        },
        {
          "id": "weak_count",
          "type": "Int",
          "expression": {
            "kind": "query",
            "operation": "count_distinct",
            "collection": "actions",
            "where": {
              "kind": "compare",
              "op": "eq",
              "left": {
                "kind": "ref",
                "path": "classification"
              },
              "right": {
                "kind": "literal",
                "value": "weak"
              }
            },
            "distinct_by": "underlying_instrument_id"
          }
        },
        {
          "id": "counter_exists",
          "type": "Truth",
          "expression": {
            "kind": "query",
            "operation": "exists",
            "collection": "actions",
            "where": {
              "kind": "compare",
              "op": "eq",
              "left": {
                "kind": "ref",
                "path": "classification"
              },
              "right": {
                "kind": "literal",
                "value": "counter"
              }
            }
          }
        }
      ],
      "score_program": {
        "rules": [
          {
            "id": "full",
            "priority": 10,
            "result": "+1",
            "when": {
              "kind": "compare",
              "op": "gte",
              "left": {
                "kind": "ref",
                "path": "strong_count"
              },
              "right": {
                "kind": "literal",
                "value": 5
              }
            }
          },
          {
            "id": "partial",
            "priority": 10,
            "result": "0",
            "when": {
              "kind": "nary",
              "op": "or",
              "operands": [
                {
                  "kind": "nary",
                  "op": "and",
                  "operands": [
                    {
                      "kind": "compare",
                      "op": "gte",
                      "left": {
                        "kind": "ref",
                        "path": "strong_count"
                      },
                      "right": {
                        "kind": "literal",
                        "value": 1
                      }
                    },
                    {
                      "kind": "compare",
                      "op": "lte",
                      "left": {
                        "kind": "ref",
                        "path": "strong_count"
                      },
                      "right": {
                        "kind": "literal",
                        "value": 4
                      }
                    }
                  ]
                },
                {
                  "kind": "nary",
                  "op": "and",
                  "operands": [
                    {
                      "kind": "compare",
                      "op": "eq",
                      "left": {
                        "kind": "ref",
                        "path": "strong_count"
                      },
                      "right": {
                        "kind": "literal",
                        "value": 0
                      }
                    },
                    {
                      "kind": "compare",
                      "op": "gte",
                      "left": {
                        "kind": "ref",
                        "path": "weak_count"
                      },
                      "right": {
                        "kind": "literal",
                        "value": 3
                      }
                    },
                    {
                      "kind": "compare",
                      "op": "lte",
                      "left": {
                        "kind": "ref",
                        "path": "weak_count"
                      },
                      "right": {
                        "kind": "literal",
                        "value": 4
                      }
                    }
                  ]
                }
              ]
            }
          },
          {
            "id": "none",
            "priority": 10,
            "result": "-1",
            "when": {
              "kind": "nary",
              "op": "or",
              "operands": [
                {
                  "kind": "ref",
                  "path": "counter_exists"
                },
                {
                  "kind": "nary",
                  "op": "and",
                  "operands": [
                    {
                      "kind": "compare",
                      "op": "eq",
                      "left": {
                        "kind": "ref",
                        "path": "strong_count"
                      },
                      "right": {
                        "kind": "literal",
                        "value": 0
                      }
                    },
                    {
                      "kind": "compare",
                      "op": "lte",
                      "left": {
                        "kind": "ref",
                        "path": "weak_count"
                      },
                      "right": {
                        "kind": "literal",
                        "value": 2
                      }
                    }
                  ]
                }
              ]
            }
          }
        ],
        "otherwise": {
          "result": "unresolved",
          "message": "The published rule text does not cover this state."
        }
      },
      "assertions": [
        {
          "id": "score_exhaustive",
          "kind": "exhaustive",
          "domains": [
            {
              "variable": "strong_count",
              "values": {
                "min": 0,
                "max": 8
              }
            },
            {
              "variable": "weak_count",
              "values": {
                "min": 0,
                "max": 8
              }
            },
            {
              "variable": "counter_exists",
              "values": [
                true,
                false
              ]
            }
          ]
        },
        {
          "id": "score_non_overlapping",
          "kind": "non_overlapping",
          "domains": [
            {
              "variable": "strong_count",
              "values": {
                "min": 0,
                "max": 8
              }
            },
            {
              "variable": "weak_count",
              "values": {
                "min": 0,
                "max": 8
              }
            },
            {
              "variable": "counter_exists",
              "values": [
                true,
                false
              ]
            }
          ]
        }
      ],
      "rationales": []
    }
  ],
  "source_map": {},
  "diagnostic_waivers": []
}
